{
  "$schema": "./docs/JERKGRAM_RELEASE.schema.json",
  "schemaVersion": 1,
  "project": "Jerkgram",
  "repository": "jerkgram/Jerkgram-iOS",
  "status": "stable",
  "jerkgramVersion": "1.1.0",
  "buildNumber": 163,
  "upstream": {
    "repository": "TelegramMessenger/Telegram-iOS",
    "tag": "release-13.0.0",
    "commit": "f1dd7a2dbd02cbbf513e75d5695d8d36d1cf5838"
  },
  "publicSourceTag": "v1.1.0",
  "ipa": {
    "filename": "Jerkgram-1.1.0.ipa",
    "sha256": "9c20a01417784d92973d5ae862e35aec827484369ee1e8c2bc3e6997f74dc61a"
  },
  "sourceSnapshot": {
    "filename": "Jerkgram-1.1.0-source.tar.xz",
    "sha256": "c586808b1839e31e8805a1c4c3449619c3d0383c8221ac9ca9b9a1b07e475b8a"
  },
  "sourceManifest": {
    "filename": "public-source-manifest.json",
    "sha256": "9d3ba5c71a01dcbe01a0a160a6d460a8f7106429b3be8eb281968b473cb4ddb2"
  }
}
